{
  "name": "bundle-analyzer",
  "description": "Analyze a JS bundle via a bundled script.",
  "source": "marketplace:acme/bundle-analyzer@1.2.0",
  "status": "available",
  "origin": { "kind": "imported", "publisher": "acme", "signature": null },
  "execution": { "kind": "script", "requires": ["shell"] },
  "created_at": "2026-07-28T12:00:00Z",
  "updated_at": "2026-07-28T12:00:00Z"
}
